{
  "version": "1.0",
  "artifact_type": "phase_review",
  "artifact_id": "pr-building-mission-20260409-vHHWWURw",
  "producer_type": "orchestration_authority",
  "mission_phase": "building",
  "status": "ready_to_exit",
  "summary": "All 3 tasks passed. Full scope delivered.",
  "gate_criteria_met": [
    "all tasks passed",
    "gap assessment complete"
  ],
  "gate_criteria_unmet": [],
  "risk_notes": [],
  "next_phase": "polishing",
  "created_at": "2026-04-09T13:16:00Z"
}
