{
  "version": "1.0",
  "artifact_type": "phase_review",
  "artifact_id": "pr-polishing-mission-20260409-vHHWWURw",
  "producer_type": "orchestration_authority",
  "mission_phase": "polishing",
  "status": "ready_to_exit",
  "summary": "No polishing needed. Cleanup mission with mechanical changes only.",
  "gate_criteria_met": [
    "no polish items"
  ],
  "gate_criteria_unmet": [],
  "risk_notes": [],
  "next_phase": "evolving",
  "created_at": "2026-04-09T13:17:00Z"
}
