{
  "version": "1.0",
  "artifact_type": "phase_review",
  "artifact_id": "pr-specifying-mission-20260409-wMdPQ77D",
  "producer_type": "orchestration_authority",
  "mission_phase": "specifying",
  "status": "ready_to_exit",
  "summary": "9 tasks compiled across 5 tracks. Design brief approved via vote round.",
  "gate_criteria_met": [
    "mission spec frozen",
    "design-brief approved",
    "tasks compiled",
    "task list approved",
    "environment setup completed"
  ],
  "gate_criteria_unmet": [],
  "risk_notes": [],
  "next_phase": "building",
  "created_at": "2026-04-09T13:36:00Z"
}
