{
  "version": "1.0",
  "artifact_type": "phase_review",
  "artifact_id": "pr-specifying-mission-20260409-vHHWWURw",
  "producer_type": "orchestration_authority",
  "mission_phase": "specifying",
  "status": "ready_to_exit",
  "summary": "Mission spec frozen, design brief approved (full_depth with vote round unanimous), 3 tasks compiled and approved. No environment setup needed.",
  "gate_criteria_met": [
    "mission spec frozen",
    "design-brief approved",
    "tasks compiled",
    "task list approved",
    "environment setup completed"
  ],
  "gate_criteria_unmet": [],
  "risk_notes": [],
  "next_phase": "building",
  "created_at": "2026-04-09T13:01:00Z"
}
